{
  "audit_record_version": "v0.8b-sanitized-audit-record",
  "run_id": "gd_20260529_001",
  "task_id": "task_20260529_001",
  "record_type": "sanitized_run_record",
  "created_at": "2026-05-29T00:00:00.000Z",
  "status": "needs_review",
  "goal_summary": "Generate a read-only provider plan for the GoalDriven workflow.",
  "criteria_count": 3,
  "risk_level": "low",
  "action_class": "read_only",
  "permission_level": "read_only",
  "provider": {
    "mode": "real-readonly",
    "name": "openai-compatible-readonly",
    "model": "configured-provider-model",
    "status": "response_received"
  },
  "approval_decision": {
    "decision": "allow",
    "blocked": false,
    "approved": false,
    "requires_human_approval": false,
    "reason_summary": "Read-only analysis may proceed after payload validation."
  },
  "timestamps": {
    "started_at": "2026-05-29T00:00:00.000Z",
    "finished_at": "2026-05-29T00:00:10.000Z"
  },
  "storage": {
    "mode": "mock_repo_contract",
    "persisted": false
  },
  "safety": {
    "no_write_default": true,
    "side_effects_enabled": false,
    "raw_prompt_stored": false,
    "raw_provider_response_stored": false,
    "secrets_stored": false
  },
  "redaction": {
    "applied": true,
    "excluded_fields": [
      "prompt",
      "full_prompt",
      "raw_prompt",
      "messages",
      "provider_request",
      "provider_response_raw",
      "provider_response_content",
      "raw_response",
      "authorization",
      "api_key",
      "token",
      "secret",
      "password",
      "credential",
      "cookie"
    ]
  }
}
